[
  {
    "id": "doener",
    "name": {
      "en": "Döner",
      "de": "Döner"
    },
    "subtitle": {
      "en": "a corner-shop classic, made at home.",
      "de": "Kioskgefühl aus deiner Küche."
    },
    "caption": {
      "en": "wrapped up in a good thing",
      "de": "ein kleines Stück Geborgenheit"
    },
    "color": "#BD7157",
    "variants": [
      "doener-classic",
      "doener-vegetarian",
      "doener-vegan",
      "doener-keto",
      "doener-halal",
      "doener-classic-easy",
      "doener-vegan-easy",
      "doener-vegetarian-easy",
      "doener-halal-easy",
      "doener-classic-light",
      "doener-vegan-light"
    ],
    "partition_id": "core",
    "secondary_partitions": [
      "cuisine-middle-eastern"
    ],
    "cuisine_tags": [
      "middle-eastern"
    ],
    "frequency_tier": "everyday"
  },
  {
    "id": "alfredo",
    "name": {
      "en": "Alfredo",
      "de": "Alfredo"
    },
    "subtitle": {
      "en": "a little silk, a little Sunday.",
      "de": "Ein bisschen Seide, ein bisschen Sonntag."
    },
    "caption": {
      "en": "twirl slowly",
      "de": "langsam aufdrehen"
    },
    "color": "#C9A35F",
    "variants": [
      "alfredo-classic",
      "alfredo-vegetarian",
      "alfredo-vegan",
      "alfredo-keto",
      "alfredo-halal",
      "alfredo-classic-balanced",
      "alfredo-vegan-easy",
      "alfredo-classic-medium",
      "alfredo-vegan-hard"
    ],
    "partition_id": "core",
    "secondary_partitions": [
      "cuisine-italian"
    ],
    "cuisine_tags": [
      "italian"
    ],
    "frequency_tier": "everyday"
  },
  {
    "id": "pad-thai",
    "name": {
      "en": "Pad Thai",
      "de": "Pad Thai"
    },
    "subtitle": {
      "en": "sweet, sour & a little kitchen clatter.",
      "de": "Süß, sauer & ein wenig Küchenklappern."
    },
    "caption": {
      "en": "a squeeze of lime changes everything",
      "de": "ein Spritzer Limette verändert alles"
    },
    "color": "#879B80",
    "variants": [
      "pad-thai-classic",
      "pad-thai-vegetarian",
      "pad-thai-vegan",
      "pad-thai-keto",
      "pad-thai-halal"
    ],
    "partition_id": "core",
    "secondary_partitions": [
      "cuisine-asian"
    ],
    "cuisine_tags": [
      "asian"
    ],
    "frequency_tier": "everyday"
  },
  {
    "id": "shakshuka",
    "name": {
      "en": "Shakshuka",
      "de": "Shakshuka"
    },
    "subtitle": {
      "en": "a pan of sunshine for a slow morning.",
      "de": "Eine Pfanne Sonnenschein für einen langsamen Morgen."
    },
    "caption": {
      "en": "bring bread, bring a friend",
      "de": "bring Brot, bring jemanden mit"
    },
    "color": "#BB6954",
    "variants": [
      "shakshuka-classic",
      "shakshuka-vegetarian",
      "shakshuka-vegan",
      "shakshuka-keto",
      "shakshuka-halal"
    ],
    "partition_id": "core",
    "secondary_partitions": [
      "cuisine-middle-eastern"
    ],
    "cuisine_tags": [
      "middle-eastern"
    ],
    "frequency_tier": "everyday"
  },
  {
    "id": "risotto",
    "name": {
      "en": "Risotto",
      "de": "Risotto"
    },
    "subtitle": {
      "en": "stir, breathe, repeat.",
      "de": "Rühren, atmen, wiederholen."
    },
    "caption": {
      "en": "good things take a wooden spoon",
      "de": "gute Dinge brauchen einen Holzlöffel"
    },
    "color": "#AA9978",
    "variants": [
      "risotto-classic",
      "risotto-vegetarian",
      "risotto-vegan",
      "risotto-keto",
      "risotto-halal"
    ],
    "partition_id": "core",
    "secondary_partitions": [
      "cuisine-italian",
      "extended"
    ],
    "cuisine_tags": [
      "italian"
    ],
    "frequency_tier": "everyday"
  },
  {
    "id": "pancakes",
    "name": {
      "en": "Pancakes",
      "de": "Pancakes"
    },
    "subtitle": {
      "en": "leave the morning a little room.",
      "de": "Lass dem Morgen ein wenig Raum."
    },
    "caption": {
      "en": "one more, then the day can begin",
      "de": "noch einer, dann beginnt der Tag"
    },
    "color": "#C99B81",
    "variants": [
      "pancakes-classic",
      "pancakes-vegetarian",
      "pancakes-vegan",
      "pancakes-keto",
      "pancakes-halal"
    ],
    "partition_id": "core",
    "secondary_partitions": [],
    "cuisine_tags": [
      "comfort"
    ],
    "frequency_tier": "everyday"
  },
  {
    "id": "ramen",
    "name": {
      "en": "Ramen",
      "de": "Ramen"
    },
    "subtitle": {
      "en": "a warm bowl for a rainy window.",
      "de": "Eine warme Schale am Regenfenster."
    },
    "caption": {
      "en": "slurp with feeling",
      "de": "mit Gefühl schlürfen"
    },
    "color": "#7F9596",
    "variants": [
      "ramen-classic",
      "ramen-vegetarian",
      "ramen-vegan",
      "ramen-keto",
      "ramen-halal"
    ],
    "partition_id": "core",
    "secondary_partitions": [
      "cuisine-asian"
    ],
    "cuisine_tags": [
      "asian"
    ],
    "frequency_tier": "everyday"
  },
  {
    "id": "chili",
    "name": {
      "en": "Chili",
      "de": "Chili"
    },
    "subtitle": {
      "en": "one pot, all the warm feelings.",
      "de": "Ein Topf, lauter warme Gefühle."
    },
    "caption": {
      "en": "better with a second spoon",
      "de": "mit einem zweiten Löffel noch besser"
    },
    "color": "#A56858",
    "variants": [
      "chili-classic",
      "chili-vegetarian",
      "chili-vegan",
      "chili-keto",
      "chili-halal"
    ],
    "partition_id": "core",
    "secondary_partitions": [],
    "cuisine_tags": [
      "comfort"
    ],
    "frequency_tier": "everyday"
  },
  {
    "id": "shepherds-pie",
    "name": {
      "en": "Shepherd's pie",
      "de": "Shepherd's Pie"
    },
    "subtitle": {
      "en": "a golden roof for a rainy day.",
      "de": "Ein goldenes Dach für einen Regentag."
    },
    "caption": {
      "en": "the corners are the best part",
      "de": "die Ecken sind das Beste"
    },
    "color": "#A89972",
    "variants": [
      "shepherds-pie-classic",
      "shepherds-pie-vegetarian",
      "shepherds-pie-vegan",
      "shepherds-pie-keto",
      "shepherds-pie-halal"
    ],
    "partition_id": "extended",
    "secondary_partitions": [],
    "cuisine_tags": [
      "comfort"
    ],
    "frequency_tier": "occasional"
  },
  {
    "id": "caesar",
    "name": {
      "en": "Caesar salad",
      "de": "Caesar-Salat"
    },
    "subtitle": {
      "en": "crunch, cream & a little lemon.",
      "de": "Knackig, cremig & ein wenig Zitrone."
    },
    "caption": {
      "en": "salad can be the whole story",
      "de": "Salat darf die ganze Geschichte sein"
    },
    "color": "#8C9A77",
    "variants": [
      "caesar-classic",
      "caesar-vegetarian",
      "caesar-vegan",
      "caesar-keto",
      "caesar-halal"
    ],
    "partition_id": "core",
    "secondary_partitions": [],
    "cuisine_tags": [
      "comfort"
    ],
    "frequency_tier": "everyday"
  },
  {
    "id": "curry",
    "name": {
      "en": "Coconut curry",
      "de": "Kokoscurry"
    },
    "subtitle": {
      "en": "a golden pot at the end of the day.",
      "de": "Ein goldener Topf am Ende des Tages."
    },
    "caption": {
      "en": "let the windows steam up",
      "de": "lass die Fenster beschlagen"
    },
    "color": "#C2A15F",
    "variants": [
      "curry-classic",
      "curry-vegetarian",
      "curry-vegan",
      "curry-keto",
      "curry-halal"
    ],
    "partition_id": "core",
    "secondary_partitions": [
      "cuisine-asian"
    ],
    "cuisine_tags": [
      "asian"
    ],
    "frequency_tier": "everyday"
  },
  {
    "id": "oatmeal",
    "name": {
      "en": "Morning oats",
      "de": "Morgenporridge"
    },
    "subtitle": {
      "en": "the first kind thing you do today.",
      "de": "Die erste liebevolle Geste des Tages."
    },
    "caption": {
      "en": "a warm bowl, an open window",
      "de": "eine warme Schale, ein offenes Fenster"
    },
    "color": "#A7A68B",
    "variants": [
      "oatmeal-classic",
      "oatmeal-vegetarian",
      "oatmeal-vegan",
      "oatmeal-keto",
      "oatmeal-halal"
    ],
    "partition_id": "extended",
    "secondary_partitions": [],
    "cuisine_tags": [
      "comfort"
    ],
    "frequency_tier": "occasional"
  }
]
